query,template_used,cypher_query,graph_hits,chunk_ids,citation_pages,retrieval_type,fallback_used,failure_note,latency_sec,n_graph_hits,n_graph_chunks,n_hybrid_chunks,n_blended_chunks,answer_quality_notes,answer_mode,graph_node_count,graph_finding_count
What renewable energy targets has the UAE committed to under its Net Zero 2050 strategy?,graphrag_country_policy_target,"         MATCH (c:Country {country_id: $country_id})-[:HAS_POLICY]->(p:Policy)-[:SETS_TARGET]->(t:Target)         OPTIONAL MATCH (d:Document)-[:DISCUSSES_POLICY]->(p)         RETURN c.name AS country,                p.name AS policy,                t.name AS target,                d.doc_id AS doc_id",usman_2026_climate_vulnerability_community_health_identifying_greensboro_neighborhoods_at_2601_15675v1; ho_2026_balancing_sustainability_performance_role_small_scale_llms_agentic_2601_19311v2; vaiapury_2025_aero_redirection_optimization_framework_inspired_judo_robust_probabilistic_2506_02415v1; makin_2025_sustainable_ai_training_hardware_software_co_design_nvidia_2508_13163v1; oliveira_filho_2025_phoeni6_systematic_evaluating_energy_consumption_neural_networks_2502_17734v1,chunk_027330; chunk_027225; chunk_038758; chunk_027321; chunk_027328; chunk_038660; chunk_027345; chunk_027232,"(Balsalobre‐Lorente et al., 2017, p. 35); (Balsalobre‐Lorente et al., 2017, p. 5); (Dumas et al., 2022, p. 32); (Balsalobre‐Lorente et al., 2017, p. 32); (Balsalobre‐Lorente et al., 2017, p. 34); (Dumas et al., 2022, p. 9); (Balsalobre‐Lorente et al., 2017, p. 40); (Balsalobre‐Lorente et al., 2017, p. 7)",graph_guided,False,,5.81,5,8,50,16,"Graph-guided: 8 graph chunks, 50 hybrid chunks, 15 page citations resolved. Overlap: 0%.",mock_prompt_no_gemini,552,15
"What high-confidence climate risks in the MENA region are documented by findings, and which sectors do they impact?",graphrag_finding_document_grounding,         MATCH (f:Finding)-[:SUPPORTED_BY]->(d:Document)         OPTIONAL MATCH (f)-[:EVIDENCES_RISK]->(risk:ClimateRisk)         OPTIONAL MATCH (f)-[:EVIDENCES_SECTOR]->(sector:Sector)         OPTIONAL MATCH (f)-[:EVIDENCES_COUNTRY]->(country:Country)         OPTIONAL MATCH (f)-[:EVIDENCES_TECHNOLO,bui_2018_carbon_capture_storage_ccs_way_forward_w2784350055; forster_2020_current_future_global_climate_impacts_resulting_covid_19_w3048190739; treutlein_2026_real_world_energy_data_200_feeders_low_voltage_2602_03521v1; mittal_2020_nanoparticle_sustainable_agriculture_food_science_recent_advances_future_w3108609864; smith_2019_current_future_role_haber_bosch_ammonia_carbon_free_w2998496658,chunk_025618; chunk_038171; chunk_004760; chunk_038150; chunk_025570; chunk_025695; chunk_025581; chunk_025688,"(Calvin et al., 2023, p. 21); (Cardenas, 2024, p. 10); (Tschakert et al., 2010, p. 12); (Cardenas, 2024, p. 8); (Calvin et al., 2023, p. 14); (Calvin et al., 2023, p. 31); (Calvin et al., 2023, p. 15); (Calvin et al., 2023, p. 30)",graph_guided,False,,1.712,5,5,50,16,"Graph-guided: 5 graph chunks, 50 hybrid chunks, 12 page citations resolved. Overlap: 0%.",mock_prompt_no_gemini,552,15
Which technologies mitigate heatwave risk in the energy sector according to climate literature?,graphrag_technology_mitigates_risk,         MATCH (tech:Technology)         WHERE $tech_id IS NULL OR tech.tech_id = $tech_id         OPTIONAL MATCH (tech)-[m:MITIGATES]->(risk:ClimateRisk)         OPTIONAL MATCH (risk)-[:IMPACTS]->(sector:Sector)         OPTIONAL MATCH (risk)-[:OCCURS_IN]->(region:Region)         OPTIONAL MATCH (d:D,chu_2016_path_sustainable_energy_w2564178799; chu_2016_path_sustainable_energy_w2564178799; chu_2016_path_sustainable_energy_w2564178799; chu_2016_path_sustainable_energy_w2564178799; chu_2016_path_sustainable_energy_w2564178799,chunk_044684; chunk_032907; chunk_038156; chunk_020433; chunk_038218; chunk_044801; chunk_038171; chunk_044833,"(Barreto et al., 2002, p. 3); (Yang et al., 2022, p. 5); (Cardenas, 2024, p. 9); (Kabeyi et al., 2022, p. 19); (Cardenas, 2024, p. 15); (Barreto et al., 2002, p. 17); (Cardenas, 2024, p. 10); (Barreto et al., 2002, p. 20)",graph_guided,False,,1.83,5,3,50,16,"Graph-guided: 3 graph chunks, 50 hybrid chunks, 13 page citations resolved. Overlap: 0%.",mock_prompt_no_gemini,552,15
How much has global mean temperature risen since pre-industrial times?,graphrag_finding_document_grounding,         MATCH (f:Finding)-[:SUPPORTED_BY]->(d:Document)         OPTIONAL MATCH (f)-[:EVIDENCES_RISK]->(risk:ClimateRisk)         OPTIONAL MATCH (f)-[:EVIDENCES_SECTOR]->(sector:Sector)         OPTIONAL MATCH (f)-[:EVIDENCES_COUNTRY]->(country:Country)         OPTIONAL MATCH (f)-[:EVIDENCES_TECHNOLO,forster_2020_current_future_global_climate_impacts_resulting_covid_19_w3048190739; smith_2019_current_future_role_haber_bosch_ammonia_carbon_free_w2998496658; bui_2018_carbon_capture_storage_ccs_way_forward_w2784350055; treutlein_2026_real_world_energy_data_200_feeders_low_voltage_2602_03521v1; ravi_2025_citizen_centered_climate_intelligence_operationalizing_open_tree_data_2508_17648v1,chunk_015769; chunk_015847; chunk_024751; chunk_046982; chunk_045098; chunk_015764; chunk_015833; chunk_015711,"(Dufresne et al., 2013, p. 22); (Dufresne et al., 2013, p. 36); (Smith et al., 2023, p. 6); (Guo et al., 2024, p. 1); (Forster et al., 2020, p. 6); (Dufresne et al., 2013, p. 34); (Dufresne et al., 2013, p. 12); (Dufresne et al., 2013, p. 23)",graph_guided,False,,2.934,5,5,50,16,"FAILURE/WEAKNESS: this is a broad numeric climate-science question, not an entity-specific graph traversal question. Current deterministic routing can use the generic Finding→Document template, which may return page-anchored evidence but not necessarily the exact temperature-rise statistic. Fix: add a ClimateIndicator/TemperatureTrend Cypher template or force hybrid-only retrieval for broad numeric trend questions.",mock_prompt_no_gemini,552,15
List all climate adaptation policies adopted by Pacific Islands countries for coastal flooding.,graphrag_finding_document_grounding,         MATCH (f:Finding)-[:SUPPORTED_BY]->(d:Document)         OPTIONAL MATCH (f)-[:EVIDENCES_RISK]->(risk:ClimateRisk)         OPTIONAL MATCH (f)-[:EVIDENCES_SECTOR]->(sector:Sector)         OPTIONAL MATCH (f)-[:EVIDENCES_COUNTRY]->(country:Country)         OPTIONAL MATCH (f)-[:EVIDENCES_TECHNOLO,bui_2018_carbon_capture_storage_ccs_way_forward_w2784350055; shah_2025_assessing_climate_vulnerability_risk_substations_massachusetts_sensitivity_2511_03748v1; treutlein_2026_real_world_energy_data_200_feeders_low_voltage_2602_03521v1; forster_2020_current_future_global_climate_impacts_resulting_covid_19_w3048190739; smith_2019_current_future_role_haber_bosch_ammonia_carbon_free_w2998496658,chunk_025767; chunk_025570; chunk_025695; chunk_025577; chunk_025687; chunk_025739; chunk_025564; chunk_025647,"(Calvin et al., 2023, p. 39); (Calvin et al., 2023, p. 14); (Calvin et al., 2023, p. 31); (Calvin et al., 2023, p. 15); (Calvin et al., 2023, p. 30); (Calvin et al., 2023, p. 36); (Calvin et al., 2023, p. 13); (Calvin et al., 2023, p. 24)",graph_guided,False,,1.645,5,5,50,16,"FAILURE/WEAKNESS: unsupported geographic entity. 'Pacific Islands' is not currently mapped to a dedicated Country/Region node or alias, so graph routing may return generic finding evidence rather than an entity-faithful Pacific-region traversal. Fix: add Pacific region aliases/nodes or force hybrid fallback when a geographic entity is unresolved.",mock_prompt_no_gemini,552,15
What does the literature say about gradient boosting methods for wind power forecasting?,graphrag_technology_mitigates_risk,         MATCH (tech:Technology)         WHERE $tech_id IS NULL OR tech.tech_id = $tech_id         OPTIONAL MATCH (tech)-[m:MITIGATES]->(risk:ClimateRisk)         OPTIONAL MATCH (risk)-[:IMPACTS]->(sector:Sector)         OPTIONAL MATCH (risk)-[:OCCURS_IN]->(region:Region)         OPTIONAL MATCH (d:D,,chunk_019177; chunk_018396; chunk_019197; chunk_049145; chunk_014749; chunk_019315; chunk_019334; chunk_019209,"(Pinson, 2013, p. 2); (Ye et al., 2024, p. 2); (Pinson, 2013, p. 4); (Ju et al., 2019, p. 1); (Abuella et al., 2017, p. 1); (Pinson, 2013, p. 21); (Pinson, 2013, p. 23); (Pinson, 2013, p. 6)",hybrid_fallback,True,Graph path returned insufficient usable evidence; hybrid fallback supplied the context.,1.455,0,0,50,16,FAILURE: Graph adds no value. 'Gradient boosting' has no Technology node in the Climate-KG; Cypher returns 0 rows; answer grounded entirely in hybrid retrieval (retrieval_type=hybrid_fallback). GraphRAG should skip graph retrieval entirely for ML-methodology / dataset-specific queries.,mock_prompt_no_gemini,552,15
